{
  "ir_version": "1.0.0",
  "tool_version": "1.1.0",
  "source": {
    "path": "docs/story/scripts/nv7/R1/NV_MAIN_002.md",
    "sha256": "e8027f71bf8179cdb09eb68cbc27c6c71e90c5d46cdc9e13b0f7844c0c2b1e16"
  },
  "baseline": {
    "min_visible_text_chars": 2500,
    "min_nodes": 6,
    "min_dialogue_nodes": 20,
    "min_choice_nodes": 2,
    "min_terminal_nodes": 1,
    "required_node_ids": [
      "commission_start",
      "story_complete"
    ]
  },
  "ownership": {
    "conditions": "GameState",
    "effects": "GameState",
    "quest_actions": "QuestManager",
    "item_rewards": "InventoryManager",
    "combat_id": "CombatRunner",
    "relationship_actions": "RelationshipManager",
    "expression": "MainUI",
    "gesture": "MainUI",
    "portrait_action": "MainUI",
    "camera": "MainUI",
    "delivery": "MainUI"
  },
  "quest": {
    "schema_version": "1.5.0",
    "quest_id": "NV_MAIN_002",
    "content_status": "complete_script",
    "title": "三份委托",
    "region_id": "NV7",
    "category": "main",
    "source_chapters": [
      "3",
      "4",
      "5"
    ],
    "source_refs": [
      "reviewed-package:R1.1/02_NV_MAIN_002_三份委托_COMPLETE_SCRIPT.md"
    ],
    "design": {
      "purpose": "第七新手村R1正式接入",
      "theme": "被困世界中的求证与协作",
      "emotion": "异常、试探、行动",
      "source": "审核通过的R1.1完整剧本包",
      "adaptation": "机械结构化，不改写核心台词",
      "conflict": "玩家在真实风险中判断行动",
      "mechanic": "对话、选择、任务与战斗引用",
      "start": "铁匠铺",
      "end": "第三界石",
      "feedback": "保留任务后回访"
    },
    "prerequisites": [],
    "mutual_exclusions": [],
    "trigger": {
      "method": "story_chain",
      "location_id": "NV7_LOC_SQUARE",
      "conditions": [],
      "opening_presentation": {}
    },
    "scenes": [
      {
        "scene_id": "a01",
        "title": "铁匠铺",
        "entry_nodes": [
          "a01_001"
        ],
        "exit_nodes": [
          "a01_choice_1"
        ],
        "participant_ids": [
          "PROTAGONIST_FENGYUE",
          "NV7_NPC_CHIEF",
          "NV7_NPC_HANSHI",
          "NV7_NPC_SUZHI"
        ],
        "objective": "铁匠铺",
        "optional_interactions": []
      },
      {
        "scene_id": "a02",
        "title": "训练木人",
        "entry_nodes": [
          "a02_001"
        ],
        "exit_nodes": [
          "a02_048"
        ],
        "participant_ids": [
          "PROTAGONIST_FENGYUE",
          "NV7_NPC_CHIEF",
          "NV7_NPC_HANSHI",
          "NV7_NPC_SUZHI"
        ],
        "objective": "训练木人",
        "optional_interactions": []
      },
      {
        "scene_id": "a03",
        "title": "矿车旁的灰背獾",
        "entry_nodes": [
          "a03_001"
        ],
        "exit_nodes": [
          "a03_choice_2"
        ],
        "participant_ids": [
          "PROTAGONIST_FENGYUE",
          "NV7_NPC_CHIEF",
          "NV7_NPC_HANSHI",
          "NV7_NPC_SUZHI"
        ],
        "objective": "矿车旁的灰背獾",
        "optional_interactions": []
      },
      {
        "scene_id": "b01",
        "title": "药棚",
        "entry_nodes": [
          "b01_001"
        ],
        "exit_nodes": [
          "b01_024"
        ],
        "participant_ids": [
          "PROTAGONIST_FENGYUE",
          "NV7_NPC_CHIEF",
          "NV7_NPC_HANSHI",
          "NV7_NPC_SUZHI"
        ],
        "objective": "药棚",
        "optional_interactions": []
      },
      {
        "scene_id": "b02",
        "title": "北坡采集",
        "entry_nodes": [
          "b02_001"
        ],
        "exit_nodes": [
          "b02_022"
        ],
        "participant_ids": [
          "PROTAGONIST_FENGYUE",
          "NV7_NPC_CHIEF",
          "NV7_NPC_HANSHI",
          "NV7_NPC_SUZHI"
        ],
        "objective": "北坡采集",
        "optional_interactions": []
      },
      {
        "scene_id": "b03",
        "title": "蓝色粉末",
        "entry_nodes": [
          "b03_001"
        ],
        "exit_nodes": [
          "b03_014"
        ],
        "participant_ids": [
          "PROTAGONIST_FENGYUE",
          "NV7_NPC_CHIEF",
          "NV7_NPC_HANSHI",
          "NV7_NPC_SUZHI"
        ],
        "objective": "蓝色粉末",
        "optional_interactions": []
      },
      {
        "scene_id": "c01",
        "title": "第一与第二界石",
        "entry_nodes": [
          "c01_001"
        ],
        "exit_nodes": [
          "c01_016"
        ],
        "participant_ids": [
          "PROTAGONIST_FENGYUE",
          "NV7_NPC_CHIEF",
          "NV7_NPC_HANSHI",
          "NV7_NPC_SUZHI"
        ],
        "objective": "第一与第二界石",
        "optional_interactions": []
      },
      {
        "scene_id": "c02",
        "title": "第三界石",
        "entry_nodes": [
          "c02_001"
        ],
        "exit_nodes": [
          "c02_065"
        ],
        "participant_ids": [
          "PROTAGONIST_FENGYUE",
          "NV7_NPC_CHIEF",
          "NV7_NPC_HANSHI",
          "NV7_NPC_SUZHI"
        ],
        "objective": "第三界石",
        "optional_interactions": []
      }
    ],
    "entry_node": "commission_start",
    "mechanics": [
      {
        "type": "story_choice"
      },
      {
        "type": "manager_integration"
      }
    ],
    "branch_summary": [
      {
        "branch": "reviewed_choices_preserved"
      }
    ],
    "continuations": [
      {
        "type": "normal",
        "node_id": "story_complete"
      },
      {
        "type": "failure",
        "node_id": "c02_001"
      }
    ],
    "rewards": [
      {
        "type": "signal_only",
        "reward_id": "NV_MAIN_002_REWARD"
      }
    ],
    "world_changes": [
      {
        "type": "registered_state_only"
      }
    ],
    "post_quest_feedback": [
      {
        "text": "任务后回访内容已保留在结构化节点中。"
      }
    ],
    "implementation": {
      "owner": "story",
      "version": 1,
      "reviewed": true,
      "offline": true,
      "notes": "R1.1审核包机械结构化；迁移映射见生成报告。"
    },
    "runtime": {
      "status_state_key": "quest.nv_main_002.status",
      "reward_granted_state_key": "quest.nv_main_002.reward_granted",
      "availability": {
        "all": [
          {
            "kind": "quest",
            "quest_id": "NV_MAIN_001",
            "op": "eq",
            "value": "completed"
          }
        ],
        "any": []
      },
      "objectives": [
        {
          "objective_id": "hanshi",
          "type": "boolean",
          "required": true,
          "progress_state_key": "quest.nv_main_002.objective.hanshi",
          "target": true
        },
        {
          "objective_id": "suzhi",
          "type": "boolean",
          "required": true,
          "progress_state_key": "quest.nv_main_002.objective.suzhi",
          "target": true
        },
        {
          "objective_id": "guchangchuan",
          "type": "boolean",
          "required": true,
          "progress_state_key": "quest.nv_main_002.objective.guchangchuan",
          "target": true
        }
      ],
      "completion_mode": "automatic",
      "failure": {
        "continuation_state_key": "quest.nv_main_002.continuation",
        "allowed_continuations": [
          "none",
          "hanshi_recovery",
          "suzhi_recovery",
          "boundary_recovery"
        ],
        "resume_from_failed": "active",
        "resume_from_suspended": "active",
        "reopen_allowed": true
      },
      "qualification": {
        "objective_ids": [
          "hanshi",
          "suzhi",
          "guchangchuan"
        ],
        "required_count": 2
      }
    },
    "allowed_loops": [
      {
        "loop_id": "parallel_commission_return",
        "node_ids": [
          "commission_hub"
        ],
        "max_recommended_repeats": 3,
        "has_exit": true
      }
    ],
    "test_cases": [
      {
        "test_id": "nv_main_002_start",
        "initial_state": {},
        "steps": [
          "commission_start"
        ],
        "expected": [
          "story_started"
        ]
      },
      {
        "test_id": "nv_main_002_route",
        "initial_state": {},
        "steps": [
          "commission_start"
        ],
        "expected": [
          "choice_or_dialogue"
        ]
      },
      {
        "test_id": "nv_main_002_complete",
        "initial_state": {},
        "steps": [
          "commission_start"
        ],
        "expected": [
          "story_complete"
        ]
      }
    ],
    "nodes": [
      {
        "node_id": "a01_001",
        "type": "narrative",
        "scene_id": "a01",
        "location_id": "NV7_LOC_FORGE",
        "purpose": "reviewed_narrative",
        "text": [
          "韩石正夹着一块烧红的铁片。"
        ],
        "next": "a01_002",
        "quest_actions": [
          {
            "action": "activate",
            "quest_id": "NV_MAIN_002"
          }
        ]
      },
      {
        "node_id": "a01_002",
        "type": "narrative",
        "scene_id": "a01",
        "location_id": "NV7_LOC_FORGE",
        "purpose": "reviewed_narrative",
        "text": [
          "枫月刚跨过门槛，韩石头也不抬。"
        ],
        "next": "a01_003"
      },
      {
        "node_id": "a01_003",
        "type": "dialogue",
        "scene_id": "a01",
        "location_id": "NV7_LOC_FORGE",
        "purpose": "reviewed_dialogue",
        "speaker_id": "NV7_NPC_HANSHI",
        "expression": "neutral",
        "portrait_action": "show",
        "text": [
          "墙角，拿一件。"
        ],
        "next": "a01_004"
      },
      {
        "node_id": "a01_004",
        "type": "narrative",
        "scene_id": "a01",
        "location_id": "NV7_LOC_FORGE",
        "purpose": "reviewed_narrative",
        "text": [
          "枫月看过去。"
        ],
        "next": "a01_005"
      },
      {
        "node_id": "a01_005",
        "type": "narrative",
        "scene_id": "a01",
        "location_id": "NV7_LOC_FORGE",
        "purpose": "reviewed_narrative",
        "text": [
          "一柄薄刃短剑、一面包铁木盾、一根带钩短杖靠在墙边。"
        ],
        "next": "a01_choice_1"
      },
      {
        "node_id": "a01_choice_1_1_response",
        "type": "narrative",
        "scene_id": "a01",